{
  "schemaVersion": "1.0.0",
  "object": {
    "name": "ContractOfferDispatchRequest",
    "package": "com.acme.vendor.dto",
    "outboundSurface": {
      "class": "DealerPortalClient",
      "method": "sendContractOffer",
      "file": "src/main/java/com/acme/vendor/DealerPortalClient.java",
      "line": 88,
      "transport": "HTTP POST /dealer/offers"
    }
  },
  "summary": {
    "fieldsFound": 18,
    "highConfidence": 13,
    "mediumConfidence": 4,
    "lowConfidence": 1,
    "primaryOrigins": [
      "Kafka ApplicationApprovedEvent",
      "ContractRepository",
      "ApplicantRepository",
      "IncomeVerificationClient",
      "DecisionEngineResult",
      "application.yml"
    ]
  },
  "objectShape": {
    "name": "ContractOfferDispatchRequest",
    "path": "$",
    "kind": "object",
    "type": "ContractOfferDispatchRequest",
    "children": [
      {
        "name": "applicationId",
        "path": "applicationId",
        "kind": "field",
        "type": "String",
        "confidence": "high",
        "mappingType": "direct"
      },
      {
        "name": "contractId",
        "path": "contractId",
        "kind": "field",
        "type": "String",
        "confidence": "high",
        "mappingType": "direct"
      },
      {
        "name": "applicant",
        "path": "applicant",
        "kind": "object",
        "type": "ApplicantDto",
        "children": [
          {
            "name": "fullName",
            "path": "applicant.fullName",
            "kind": "field",
            "type": "String",
            "confidence": "high",
            "mappingType": "derived"
          },
          {
            "name": "primaryEmail",
            "path": "applicant.primaryEmail",
            "kind": "field",
            "type": "String",
            "confidence": "medium",
            "mappingType": "lookup"
          }
        ]
      },
      {
        "name": "financialTerms",
        "path": "financialTerms",
        "kind": "object",
        "type": "FinancialTermsDto",
        "children": [
          {
            "name": "amountFinanced",
            "path": "financialTerms.amountFinanced",
            "kind": "field",
            "type": "BigDecimal",
            "confidence": "high",
            "mappingType": "direct"
          },
          {
            "name": "monthlyPayment",
            "path": "financialTerms.monthlyPayment",
            "kind": "field",
            "type": "BigDecimal",
            "confidence": "high",
            "mappingType": "direct"
          },
          {
            "name": "paymentToIncomeRatio",
            "path": "financialTerms.paymentToIncomeRatio",
            "kind": "field",
            "type": "BigDecimal",
            "confidence": "medium",
            "mappingType": "derived"
          }
        ]
      },
      {
        "name": "vehicle",
        "path": "vehicle",
        "kind": "object",
        "type": "VehicleDto",
        "children": [
          {
            "name": "vin",
            "path": "vehicle.vin",
            "kind": "field",
            "type": "String",
            "confidence": "high",
            "mappingType": "direct"
          },
          {
            "name": "displayName",
            "path": "vehicle.displayName",
            "kind": "field",
            "type": "String",
            "confidence": "high",
            "mappingType": "derived"
          }
        ]
      },
      {
        "name": "decision",
        "path": "decision",
        "kind": "object",
        "type": "DecisionDto",
        "children": [
          {
            "name": "status",
            "path": "decision.status",
            "kind": "field",
            "type": "DecisionStatus",
            "confidence": "medium",
            "mappingType": "conditional"
          },
          {
            "name": "reasons[]",
            "path": "decision.reasons[]",
            "kind": "array",
            "type": "List<DecisionReasonDto>",
            "children": [
              {
                "name": "code",
                "path": "decision.reasons[].code",
                "kind": "field",
                "type": "String",
                "confidence": "high",
                "mappingType": "direct-list"
              },
              {
                "name": "text",
                "path": "decision.reasons[].text",
                "kind": "field",
                "type": "String",
                "confidence": "high",
                "mappingType": "derived-list"
              }
            ]
          }
        ]
      },
      {
        "name": "dealer",
        "path": "dealer",
        "kind": "object",
        "type": "DealerDto",
        "children": [
          {
            "name": "dealerId",
            "path": "dealer.dealerId",
            "kind": "field",
            "type": "String",
            "confidence": "high",
            "mappingType": "direct"
          },
          {
            "name": "callbackUrl",
            "path": "dealer.callbackUrl",
            "kind": "field",
            "type": "URL",
            "confidence": "high",
            "mappingType": "lookup"
          }
        ]
      },
      {
        "name": "riskBand",
        "path": "riskBand",
        "kind": "field",
        "type": "String",
        "confidence": "medium",
        "mappingType": "enriched"
      },
      {
        "name": "metadata",
        "path": "metadata",
        "kind": "object",
        "type": "DispatchMetadataDto",
        "children": [
          {
            "name": "sourceSystem",
            "path": "metadata.sourceSystem",
            "kind": "field",
            "type": "String",
            "confidence": "high",
            "mappingType": "config"
          },
          {
            "name": "sentAt",
            "path": "metadata.sentAt",
            "kind": "field",
            "type": "Instant",
            "confidence": "high",
            "mappingType": "runtime"
          },
          {
            "name": "internalNotes",
            "path": "metadata.internalNotes",
            "kind": "field",
            "type": "String",
            "confidence": "low",
            "mappingType": "dynamic"
          }
        ]
      }
    ]
  },
  "fields": [
    {
      "path": "applicationId",
      "confidence": "high",
      "mappingType": "direct",
      "description": "Identifier copied from the inbound Kafka event and reused as the primary key for downstream loads.",
      "lineage": {
        "nodes": [
          {
            "id": "assign",
            "kind": "assignment",
            "title": "setApplicationId(appId)",
            "subtitle": "Assignment",
            "meta": "ContractOfferMapper.map(...) line 42",
            "tier": 0,
            "row": 0
          },
          {
            "id": "param",
            "kind": "method",
            "title": "appId parameter",
            "subtitle": "map(ApplicationApprovedEvent event)",
            "meta": "resolved from event.getApplicationId()",
            "tier": 1,
            "row": 0
          },
          {
            "id": "event",
            "kind": "event",
            "title": "ApplicationApprovedEvent.applicationId",
            "subtitle": "Kafka input boundary",
            "meta": "topic: contract.application-approved",
            "tier": 2,
            "row": 0
          }
        ],
        "edges": [
          [
            "FIELD",
            "assign",
            "assigned by"
          ],
          [
            "assign",
            "param",
            "value from"
          ],
          [
            "param",
            "event",
            "read from"
          ]
        ]
      }
    },
    {
      "path": "contractId",
      "confidence": "high",
      "mappingType": "direct",
      "description": "Contract identifier copied from the contract aggregate loaded by application id.",
      "lineage": {
        "nodes": [
          {
            "id": "assign",
            "kind": "assignment",
            "title": "setContractId(contract.getId())",
            "subtitle": "Assignment",
            "meta": "ContractOfferMapper.map(...) line 47",
            "tier": 0,
            "row": 0
          },
          {
            "id": "contract",
            "kind": "source",
            "title": "Contract.id",
            "subtitle": "Entity field",
            "meta": "Contract aggregate",
            "tier": 1,
            "row": 0
          },
          {
            "id": "repo",
            "kind": "repository",
            "title": "ContractRepository.findByApplicationId(appId)",
            "subtitle": "Database boundary",
            "meta": "table: contract",
            "tier": 2,
            "row": 0
          }
        ],
        "edges": [
          [
            "FIELD",
            "assign",
            "assigned by"
          ],
          [
            "assign",
            "contract",
            "read from"
          ],
          [
            "contract",
            "repo",
            "loaded by"
          ]
        ]
      }
    },
    {
      "path": "applicant.fullName",
      "confidence": "high",
      "mappingType": "derived",
      "description": "Full name is derived from individual applicant name fields and a hardcoded space delimiter. Each input field is traced separately.",
      "lineage": {
        "nodes": [
          {
            "id": "assign",
            "kind": "assignment",
            "title": "setFullName(buildFullName(applicant))",
            "subtitle": "Assignment",
            "meta": "ApplicantMapper.map(...) line 33",
            "tier": 0,
            "row": 0
          },
          {
            "id": "transform",
            "kind": "transform",
            "title": "NameFormatter.buildFullName(applicant)",
            "subtitle": "Transform",
            "meta": "first + optional middle + last",
            "tier": 1,
            "row": 0
          },
          {